,country,title,image_link,source,content,published_at,link
43,Korea,"""코스피, PBR 금융위기 수준까지 하락…지금은 언더슈팅 구간""",https://img.hankyung.com/photo/202411/01.38699154.1.jpg,한국경제,"올해 '코스피' 및 '삼성전자 제외 코스피' 추이. 자료=신한투자증권 코스피지수가 과거 금융위기 수준인 주가순자산비율(PBR) 0.85배 수준까지 하락했다. 트럼프 당선에 따른 통상 마찰 리스크(위험)와 중국 저가 수출, 대장주인 삼성전자의 기술력 우려 부상 등 영향이다. 이런 가운데 증권가에서는 현재 코스피 가격은 언더슈팅(과도하락) 상태라면서 ""2700선 중반을 목표로 지수가 반등을 시도할 수 있는 구간""이라고 짚었다.20일 노동길 신한투자증권 연구원은 ""지난 여름 2900선을 겨냥하던 국내 증시는 어느덧 2400선에서 등락 중""이라며 ""코스피 12개월 선행 주가수익비율(PER)은 8.2배까지 하락했고, 12개월 후행 장부가는 0.85배 수준으로 밀려났다""고 밝혔다. 노 연구원은 통상 마찰과 중국 저가 수출, 삼성전자 의구심 여파로 지수가 조정되는 것이라고 설명했다. 다만 어느 때보다 밸류에이션이 낮아진 현 상황에서, 국내 증시의 반응이 과도한지 여부를 따져봐야 한다고 조언했다. 그는 현 증시가 언더슈팅 상황에 놓여 있단 판단이다. 노 연구원은 ""주식시장은 미래 악재를 선반영하는 특성을 갖고 있다. 코스피 수준은 '역대급'으로 낮은 자기자본이익률(ROE)을 가정하고 있다""며 ""우려가 최대인 시점은 트럼프 행정부 출범 직전까지다. 걱정한 미래가 현실화하지 않는다면 선반영한 리스크를 되돌릴 수 있다. 올해보단 내년 초에 추세적 반등을 꾀할 수 있을 전망""이라고 말했다.중국 과잉 생산과 저가 수출도 큰 문제는 아니라고 짚었다. 중국 반도체 과잉 생산은 한국에 직접적인 타격이라고 보기 어렵다는 판단에서다. 그는 ""중국 과잉 공급 문제는 배터리, 의류, 철강, 태양광 등에 국한한 것""이라며 ""중국 반도체 제조 능력은 이전 10년보다 향후 10년 약화되리라 전망할 수 있다. 세계 반도체 제조 설비 증가를 견인할 국가는 이제 중국에서 미국, 한국, 유럽 등으로 이동할 전망""이라고 말했다.삼성전자의 기술력에 대한 의구심도 덜 필요가 있다고 봤다. 코스피는 연초 이후 지난 18일까지 7% 하락했다. 삼성전자를 제외하면 1.3% 하락에 그쳤다. 대장주에 대한 우려가 컸다는 해석이 가능하다. 이에 대해 노 연구원은 ""지금은 밸류에이션 반등을 불러올 구간""이라며 ""10조원 규모 자사주 매입 계획 발표(3조원은 3개월내 소각)는 주가 하방을 두껍게 만들 수 있는 변수""라고 말했다. 그는 ""지금 장은 종목 장세에 가깝다""며 ""올해는 마진 보호력이 높은 내수가 유리하다. 내년 1분기 중 수출주 비중을 확대하는 전략을 권한다""고 말했다.신민경 한경닷컴 기자 radio@hankyung.com",2024.11.20 08:04,https://www.hankyung.com/article/2024112023406
44,Korea,"""알테오젠, 키트루다SC 상업화 따라 글로벌 바이오텍으로 부상""-신한",https://img.hankyung.com/photo/202411/01.37998939.1.jpg,한국경제,"박순재 알테오젠 대표. 신경훈 기자 khshin@hankyung.com 신한투자증권은 20일 알테오젠에 대해 키트루다(펨브롤리주맙) 피하주사(SC)의 성공적인 임상 3상 결과가 나온 데 따라 상업화가 가능한 기술 플랫폼을 보유하게 됐다고 평가했다. 그러면서 투자의견은 ‘매수’, 목표주가는 73만원을 유지했다.엄민용 신한투자증권 연구원은 “키트루다SC에 대한 성공적인 임상 3상 톱라인 결과가 머크의 홈페이지에 게시됐는데, 알테오젠(Alteogen Inc.)이 처음으로 머크로부터 공식 언급된 것도 의미가 있다”고 평가했다.특히 그는 “알테오젠은 국내 바이오텍 중에서 상업화에 성공한 최초의 기술 플랫폼을 보유한 기업이자, 공장까지 갖추는 첫 회사가 될 것”이라며 “현재 기술이전을 논의 중인 6개 빅파마의 의사결정도 쉬워질 것”이라고 말했다.키트루다SC 상업화에 따른 직접적인 수익성 향상도 기대된다. 우선 임상 3상 성공에 따른 단계별 기술료(마일스톤) 1조4000억원은 상업화 후 2년 안에 인식할 예정이다.판매 로열티 규모도 만만찮다. 면역관문억제제인 키트루다가 세계에서 가장 많은 매출을 올리는 의약품이기 때문이다. 신한투자증권은 향후 키트루다SC가 연간 20조~30조원 수준의 매출을 올리고, 판매로열티 비율이 4~5%라는 추정 하에 알테오젠이 연간 1조원 이상의 로열티를 인식할 수 있을 것으로 보고 있다.한경우 한경닷컴 기자 case@hankyung.com",2024.11.20 08:08,https://www.hankyung.com/article/2024112023956
45,Korea,"""삼성생명, 삼성전자 자사주 소각시 특별배당 기대""-신한",https://img.hankyung.com/photo/202411/AD.38347537.1.jpg,한국경제,"사진=삼성생명 신한투자증권은 20일 삼성생명에 대해 ""삼성전자가 자사주를 소각할 경우 특별배당을 기대할 수 있을 것""이라고 분석했다. 투자의견 '매수'와 목표주가 12만원은 유지했다.이 증권사 임희연 연구원은 ""현행 금융산업 구조조정에 관한 법률(금산법)은 금융 계열사가 비금융 계열사 지분 10% 이상 보유하는 것을 제한해 (삼성전자의) 자사주 소각 시 삼성생명과 삼성화재의 전자 지분 처분이 필수""라며 ""현재 삼성생명과 삼성화재는 삼성전자 지분을 각각 8.51%와 1.49% 보유하고 있다""고 분석했다.이어 ""지난 2018년 삼성전자 지분 처분 당시에도 처분이익이 특별배당으로 이어졌다""며 ""유배당 계약 결손 고려 시 자본 유출이 제한적이며, 주식 위험 감소로 인한 신지급여력비율(K-ICS) 개선 등을 감안하면 이번에도 특별배당 가능성 배제할 수 없다""고 설명했다.앞서 삼성전자는 향후 1년 내 총 10조원 규모의 자사주를 분할 매수할 계획이라고 지난 15일 공시했다. 이중 약 3조원 규모는 내년 2월17일까지 소각할 예정이다.고정삼 한경닷컴 기자 jsk@hankyung.com",2024.11.20 08:09,https://www.hankyung.com/article/2024112023886
46,Korea,"우크라이나 ‘에이태큼스’ vs. 러시아 ‘핵무기’! 최악 시나리오, 세계 3대 대전 발발하나? [한상춘의 지금세계는]",,한국경제,"미국 시간으로 오늘 주주들의 최대 관심사인 엔비디아 3분기 실적 발표를 앞두고 3차 세계대전 우려로 숨죽인 하루였는데요. 다행인 것은 시장이 발 버티면서 증시 폭락 현상은 발생하지 않았습니다. 문제는 극단적인 이익을 강조하는 트럼프 정부가 출범하면 3차 세계대전 우려가 지속될 수 밖에 없을 것으로 생각하는데요. 세계에서 유일하게 분단국인 우리 입장에서는 이 문제만큼 중요한 것도 없지 않나 생각합니다. 도움 말씀에 한국경제신문사의 한상춘 논설위원 나와 계십니다.Q. 오늘 미국 금융시장은 3차 대전 우려가 짓눌렸는데요. 3차 대전의 중압감에 비해 비교적 잘 버티었지 않았습니까?- foreign affairs, 쇠퇴하는 中과 러시아 위험- 위기감 느낀 푸틴과 시진핑, 군사적 모험주의- 할 브랜즈 존스홉킨스대 교수, 美 침공 우려- 1차 대전 ‘독일, 2차 대전 ’일본‘의 사례 들어- 죽기 전 키신져, “3차 대전 치를 수 있다”- 바이든, 에이태큼스 허용…푸틴과 핵무기 대응?- 트럼프과 푸틴 밀월관계, 3차 대전 우려 완화Q. 지난 달 이 시간을 통해 11월 지정학적 위기설을 언급해 주셨습니다만 3차 대전 우려가 나오는 것은 세계 통수권자들이 중재 역할을 하지 못하는 것이 원인이지 않습니까?- 선거의 해 올해, 주요국 통수권자일수록 수난- G7 회원국 중 일본·영국 등 최고통수권자 교체- 내년 1월 20일, 美 조 바이든 대통령 물러나- 마크롱·슐츠·트뤼도 위상 추락해 종전만 못해- S2, 사회주의 양대국 통수권자 위상 크게 약화- 시진핑, 경기침체 장기화로 장기집권 체제 균열- 푸틴, 전쟁 장기화 따른 국력 소모로 곤혹 치러- 중심축 역할인 G7과 S2 부재, 초불확실성 시대Q. 중심축 국가들이 역할을 못함에 따라 러시아와 우크라이나 전쟁, 이스라엘과 팔레스티안 간의 전쟁이 장기화되고 있지 않습니까?- 디지털 시대 전쟁, 조기 종전보다 더 장기화- 우크라이나-러시아 전쟁, 내년 2월이면 3년 째- 이스라엘과 팔레스타인 전쟁, 1년 이상 장기화- 국가 간 전쟁뿐만 아니라 내전도 장기화 양상- 인종·종교·난민 등 디스토피아 문제 놓고 갈등- 이상기후 등에 따른 식량난 해결 위한 갈등- 글로벌 지정학적 지수(GPRI), 역대 최고치 달해Q. 가장 우려하는 3차 대전이 발생하지 않으려면 중심축 역할을 해야 할 최고통수권자들이 협력해야 하는데요. 트럼프 정부가 탄생하면 더 어려워지지 않겠습니까?- G7과 S2 중심축 역할 약화, ‘에고노미 시대’- egonomy=ego+economy, 자국의 이익 우선- 위기에 몰릴수록 군사적 군국주의 택할 확률- 트럼프 집권 2기, 신주권 국제질서 더 강화- ‘다자 자유무역’보다 ’트럼프 먼로주의‘ 지향- 중층적 분권화, 탈미국·탈달러화 노력 더 강화- 크루그먼 교수, 2차 대전 직전 상황과 비슷해Q. 문제는 궁지에 몰리는 통수권자일수록 국민들의 관심을 나라 밖으로 돌리기 위해 강력한 군축론을 주장하고 있지 않습니까?- 김정은의 북한군 러시아 파병, 대표적인 사례- 푸틴·네타냐후 대통령도 같은 이유로 전쟁 선택- 권력욕 강한 이시바, 선거 참패에도 버티기- 당초 예상대로 자진사퇴보다 연정 통해 재집권- 위상 약화된 이시바, 어디에서 출구 마련할까?- 대내보다는 대외쪽으로 마련, 군국주의 지향- 군국주의 지향, ‘방어적’에서 ‘공세적’으로 전환Q. 당초 3차 대전 가능성은 미국과 러시아보다는 미국과 중국 간 경제패권 마찰에서 우려됐지 않았습니까?- 1970년대 핑퐁 외교, ‘커플링’ 관계에서 출발- 中, ‘도광양회(韜光養晦?참고 기다린다)’와 조화- 美의 잠재적인 경제패권 경쟁자 지위까지 성장- 中, ‘주동작위(主動作爲?목소리를 낸다)로 선회- 강경한 입장 中, 최악 상황 돌파 위해 美 필요- 정랭경온(政冷經溫), 군사 ‘냉랭’?경제 ‘친밀’ 유지- 대만과의 관계, 작년 양회 이어 ‘92 공식’ 누락- 92공식 누락, ‘디리스킹’ → ‘디커플링’ 전략으로Q. 문제는 내년 1월 트럼프 정부가 재출발하면 미·중 간의 3차 대전에 대한 우려가 다시 불거질 가능성이 높지 않습니까?- 트럼프 2기, 中 존재 부정 ’라이트 하이저 패러다임‘- 로버트 라이트 하이저, 집권 2기에도 USTR 대표- 라이트 하이저 패러다임, “中은 악, 근원은 공산당”- 라이트 하이저, 집권 1기 나바로 패러다임 더 보강- 中, 보유 달러와 국채 매각 및 美 투자자산 회수- 시진핑, 브릭스 국가 중심 동맹 더욱 강화- 위기에 몰린 시진핑, 일국일제 명목 대만 침공?- 키신저와 크루그먼, ‘미·중 3차 대전 가능성’ 경고Q. 문제는 우리나라인데요. 글로벌 지정학적 위험이 고조되는 분위기의 중심에 놓여있는 곳이 한반도이지 않습니까?- 韓, 트럼프 재집권하면 ’갈라파고스 함정‘?- 푸틴, 잇달아 트럼프 재집권 환영하는 발언- 김정은, 美 겨냥 시진핑보다 푸틴과 관계개선- 트럼프, 대선기간 중 김정은과 관계 연일 자랑- 韓에 대해 안보 무임승차 이유로 부담 압력- 4자 관계, 트럼프+푸틴+이시바 vs, 시진핑- 6자 관계, 對美 편향과 中 소원했던 韓의 입장?- 한국을 둘러싼 ‘지정학적 위기설’, 계속 나돌 듯지금까지 한국경제신문사의 한상춘 논설위원이었습니다.김채은PD ckim@wowtv.co.kr",2024.11.20 08:12,https://www.hankyung.com/article/2024112024115
47,Korea,"""엘앤에프, 북미 고객사 판매량 증가 수혜""-교보",https://img.hankyung.com/photo/202411/01.36234365.1.jpg,한국경제,"엘앤에프 사옥./사진=한경 DB 교보증권은 20일 엘앤에프에 대해 ""내년에는 북미 고객사의 판매량 증가에 따른 수혜를 볼 것""이라고 전망했다. 투자의견 '매수'와 목표주가 14만원은 유지했다.이 증권사 최보영 연구원은 ""성공적인 4680 배터리(지름 46㎜에 높이 80㎜)로의 공급 개시와 내년 1분기 2170(지름 21mm에 높이 70mm) 배터리 출하에 따라 점진적인 물량 회복이 기대된다""며 ""재고평가손실이 최대한 반영되며 내년에는 손익이 개선될 것""이라고 봤다.특히 내년 북미 고객사의 판매량 증가와 트럼프 행정부의 수혜를 같이 볼 수 있을 것으로 최 연구원은 진단했다. 다만 당장 올 4분기 적자 폭은 확대될 것으로 전망했다. 최 연구원은 ""전방시장 불확실성에 따라 고객사들의 투자 결정이 지연돼 NCM523(니켈 50%·코발트 20%·망간 30% 비율) 제품 출하량 역시 부진하다""며 ""원자재 가격 하락을 전망하며 재고자산평가손실 반영 여부에 따라 영업 적자가 더욱 확대될 것""이라고 말했다.교보증권은 엘앤에프의 올 4분기 매출을 전년 동기 대비 47.3% 줄어든 3462억원으로 추정했다. 같은 기간 영업손실은 1004억원으로 적자 전환을 예상했다.고정삼 한경닷컴 기자 jsk@hankyung.com",2024.11.20 08:36,https://www.hankyung.com/article/2024112024536
48,Korea,월가 최악 카드는 피했다…재무장관 지명에 촉각 [글로벌마켓 A/S],https://img.hankyung.com/photo/202411/B20241120083004613.jpg,한국경제,"미국 뉴욕증시가 러시아와 우크라이나 사이의 전쟁 격화 우려를 덜어내고 반등을 이어갔다. 하루 뒤 3분기 실적을 공개할 예정인 엔비디아가 4% 급등해 지수 전체 반등을 주도했다. 도널드 트럼프 대통령 당선인이 차기 상무장관에 하워드 러트닉 캔터 피츠제럴드 최고경영자를 지명하면서 시장의 우려를 덜어냈다.현지시간 19일 뉴욕증권거래소에서 S&P(스탠더드앤드푸어스)500 지수는 전 거래일보다 23.36포인트, 0.4% 오른 5,916.98포인트를 기록했다. 나스닥은 엔비디아와 애플, 알파벳 등 기술주 반등으로 전날보다 195.66포인트, 1.04% 상승한 1만 8,987.47로 1만 9천선에 다시 근접했다. 다우존스 산업평균지수는 월마트의 깜짝 실적에도 헬스케어, 보험 섹터 약세로 인해 120.66포인트, 0.28% 밀린 4만 3,268.94에 장을 마감했다.● 러-우 전쟁보다 트럼프…차기 재무장관 지명에 촉각이날 오전까지 위험 자산에 부담 요인으로 작용하던 러시아와 우크라이나간 지정학 위기는 오래 가지 못했다. 뉴욕상업거래소(NYMEX)에서 국제 금 12월물 가격은 트로이온스당 0.81% 오른 2,635.70달러로 올라섰다. 하락하던 일본 엔화는 달러대비 0.02% 소폭 반등해 1달러당 154.62엔을 기록했다.우크라이나는 지난 17일 미국 육군전술미사일시스템(ATACMS, 에이태큼스)를 이용한 조 바이든 미 대통령의 발사 허용 하루 만에 러시아에 대한 공습을 단행했다. 우크라이나는 국경에서 115km 떨어진 러시아 브랸스크 지역의 카라체프 마을 근처의 대규모 무기고를 표적으로 이번 공습을 단행한 것으로 전해졌다. 이에 대해 러시아 국방부는 모두 6기의 미사일 가운데 5기는 격추하고, 나머지 1기는 일부 파손됐지만 사상자는 발생하지 않았다고 주장했다. 러시아 타스 통신에 따르면 세르게이 라브로프 러 국방부장관은 “미국이 없다면 첨단 미사일 발사는 불가능했을 것”이라며 서방의 개입에 공개적인 거부감을 드러냈다.러시아는 또한 이번 공습 이후 기존 핵무기 사용 조건을 대폭 완화하는 발표로 안전자산 가격을 밀어올렸다. 드리트리 페스코프, 러시아 대통령 대변인은 “명시된 것처럼 재래식 무기로 러시아 주권과 영토에 중대한 위협얼 하는 경우 핵무기를 사용하도록 했다”면서 “핵 보유국의 참전 또는 핵 보유국의 지원을 받은 나라가 러시아를 공습시 공동 공격으로 간주한다고 명시되어 있다”고 강조했다. 미국과 우크라이나를 명시하지 않았지만 사안의 위험성이 커지면서 금융시장도 오전 약세로 출발했다. 차기 미 상무장관으로 지명된 하워드 루트닉(62세) 캔터 피츠제럴드 최고경영자 이러한 시장 분위기는 오후들어 트럼프 내각의 윤곽이 추가로 드러난 뒤 상승세로 크게 돌아섰다. 트럼프 행정부 차기 내각 가운데 재무장관 후보로 거론 되어 온 하워드 루트닉 캔터 피츠제럴드 최고경영자가 이날 상무부 장관으로 정식 지명을 받았다. 트럼프 당선인은 소셜미디어 트루스 소셜을 통해 “인수위원회 공동의장으로 미국 역사상 가장 효율적이고 정교한 시스템을 구축했다”고 추켜세웠다.당초 트럼프 대통령은 하워드 루트닉을 재무장관으로 고려했으나, 월가 헤지펀드 매니저 출신인 스콧 베센트를 지지하는 내부 갈등으로 인해 인선 결과가 뒤집혔다. 일론 머스크 테슬라 최고경영자는 이번 인선에 앞서 루트닉에 대해 “실제로 변화를 일으킬 인물”이라며 베센트는 “평범한 선택”이라고 공개적으로 루트닉을 지지해왔다.이번 주 시장 영향력이 큰 지표 발표가 없는 가운데 월가는 트럼프의 차기 재무장관에 촉각을 세우고 있다. 블룸버그 등에 따르면 현재 유력한 인물로 케빈 월시(Kevin Warsh) 전 연준(Fed) 최연소 이사가 거론되고 있다. 당초 스콧 베센트 키스퀘어 창업자가 하마평에 올랐으나 역시 미정인 백악관 국가경제위원회(NEC) 지명이 유력한 것으로 전해지고 있다. 다만 케빈 월시 전 이사는 연준의 독립성을 옹호하고, 보호무역주의에 대해 강한 거부감을 표명해온 인사로 트럼프 당선인이 공약으로 내세운 관세 부과 등에서 이견이 일어날 우려가 있다. 이 때문에 르네상스매크로 리서치의 닐 두다 책임은 “연준을 떠나기전 양적완화에 반대해온 강력한 매파”라며 의문을 표했다. 다만 연준의 움직임을 이해한 인물의 재무장관 지명시 향후 두 기관의 정책적인 보조를 기대할 수 있다는 전망도 나오고 있다. 이러한 전망에 따라 이날 국채금리는 10년물 기준 전날보다 2.4bp 내린 4.39%로 진정세를 보였다.이날 경제 지표는 10월 주택착공 건수가 연율 131만 1천 건으로 시장 예상치 134만 건보다 낮았고, 주택 허가건수도 141만 6천 건으로 예상보다 약 3만 건 가량 적었다. 주택시장이 바닥을 다지고 있는 가운데, 연준의 기준금리 인하 이후의 시장 회복을 기다리는 수요가 시장에 반영되고 있다. 주택 시장이 더딘 회복을 보이면서 지난 분기 어닝 쇼크를 기록한 주택용품 유통 2위 업체 로우스는 이날 4.6% 급락했다. ● 증시 운명 달려있는 엔비디아 실적 D-1..월가는 ""블랙웰 문제 없다""미국 증시에서 가장 영향력이 큰 종목인 엔비디아가 하루 뒤인 현지시간 20일 장 마감 이후 2025 회계연도 3분기 실적을 공개한다. 올해 8월부터 10월까지 실적에 대해 월가는 대체로 긍정적인 평가를 유지하고 있다. 지난 주말 디 인포메이션지의 단독 보도로 알려진 엔비디아 블랙웰 가속기 72기를 장착한 NVL72 서버 과열 우려에도 주요 하이퍼스케일러를 비롯한 고객에 대한 납품 일정에 문제가 없다는 평가가 나온다. 엔비디아 목표가 190달러로 월가에서 두 번째고 높은 가격을 제시한 뱅크오브아메리카의 왐시 모한 애널리스트는 “블랙웰 우려에도 수요 모멘텀에는 영향을 주지 않을 것”이라고 밝혔다. 다만 그는 “2026회계연도(내년 2월~2026년1월) 주당순이익을 5달러 이상으로 유지하려면 매출총이익률을 73~74% 수준으로 유지해야 한다”고 전망했따.에버코어ISI는 클라우드 서비스 수요와 하이퍼스케일러의 자본지출이 이어지는 점을 감안해 시장수익률 상회 의견을 유지했고, 모건스탠리 역시 단기적인 가이던스 상향이 예상된다며 비중확대와 목표가 160달러를 제시했다. 스티펠과 제프리스, 오펜하이머 등도 주당 180달러 안팎의 목표가를 냈다. 이번 3분기 호퍼 아키텍처와 블랙웰 기반 수요가 교차하는 전환기를 지나면 AI 가속기 시장의 점유율을 바탕으로 가이던스 상향이 가능하다는 평가가 주를 이뤘다.기술주를 제외하고 이날 미 기업 가운데 지수 영향력이 가장 컸던 종목은 월마트다. 로버트 케네디 주니어 보건부 장관 지명 이후 헬스케어, 보험 관련 섹터가 약세를 이어간 가운데 다우지수를 지지했다. 월마트는 소비 둔화, 인플레이션 등 올해 내내 불거진 각종 우려를 딛고 상품 부문 매출의 성장세를 이어갔다. 월마트가 공개한 3분기 매출액은 전년대비 5.5% 증가한 1,696억 달러로 시장 예상을 웃돌았고, 일회성 요인을 뺀 조정 주당순익은 58센트로 예상치 53센트를 상회했다. 유통 기업의 주요 경영지표인 동일매장 매출은 전년대비 5.3% 성장해 예상치 3.8%를 웃돌았다.북미 기반이지만 월마트의 인터내셔널 부문은 중국을 포함한 시장에서 8% 성장하고, 전체 전자상거래 매출액이 전년대비 22% 고성장하는 등 주요 부문이 견고한 성적을 거뒀다. 월마트는 이를 반영해 이번 연도 연간 순매출 성장 예상치를 기존 3.75~4.75%에서 4.8~5.1%로 대폭 상향했다. 존 데이비드 레이니 최고재무책임은 “식료품을 제외한 일반 상품 판매가 두 분기 연속 성장했다”고 실적 증가 배경을 밝혔다. 미국 소비자들은 인플레이션을 의식해 가성비 소비를 하면서도 이번 홀리데이 시즌에 소비를 늘리고 있는 것으로 나타났다. 또한 월마트플러스를 통한 구독 프로그램을 이용하는 소비자들은 추가 비용 지불에도 3시간 거리 배송 서비스 이용을 늘리는 등 이커머스 부문 거래가 크게 늘어난 것으로 나타났다. 이러한 실적과 전망치 발표로 인해 월마트는 하루 3% 강세로 마감했다. 아크 이노베이션 ETF의 연도별 성과 추이 (출처:ARK INVEST) 테슬라는 캐시 우드가 이끄는 아크 이노베이션 상장지수펀드(ARKK)의 일부 지분 처분 소식에도 2.14% 뛰었다. 앞서 아크 인베스트먼트는 전날 약 3만 939주의 테슬라 지분을 매도한 사실을 공개했다. 이번 처분에도 해당 ETF가 보유한 테슬라 지분은 약 15.33%에 달한다.대형 기술주를 제외한 종목 가운데 변동성이 가장 컸던 종목은 AI 서버 수요로 혜택을 봤던 슈퍼마이크로컴퓨터다. 슈퍼마이크로 컴퓨터는 상반기(10-K), 반기(10-Q) 보고서 미체출로 인한 회계 부정 의혹으로 급락했으나, 전날 저녁 나스닥 상장 요건을 가까스로 채워 주가 반등을 만들어냈다. 찰스 리앙 최고경영자는 언스트앤영(EY)을 대신할 독립 감사인에 BDO를 지정했다고 밝혔다. 나스닥은 슈퍼마이크로컴퓨터가 제출한 상반기, 분기 재무제표를 포함한 보고서 작성에 대해 최대 5주간 심사를 거쳐 상장 여부를 결정할 예정이다. 지난 주까지 고점 대비 70% 넘게 하락했던 주가는 이번 발표로 하루 30% 폭등하는 등 불안정한 흐름을 이어갔다. 미국 세무 회계 프로그램 제공업체인 인튜이트가 트럼프 정부의 무료 세무 신고앱 제공 계획이 알려진 뒤 5% 가량 내렸고, AI에 기반한 에너지 수요 증가 기대로 GE버노바와 비스트로 에너지가 각각 4.5%, 5.6% 강세를 기록했다.김종학기자 jhkim@wowtv.co.kr",2024.11.20 08:43,https://www.hankyung.com/article/2024112024925
